,hans-lexical_overlap-contradiction_loss,hans-lexical_overlap-contradiction_accuracy,hans-lexical_overlap-contradiction_score_accuracy,hans-lexical_overlap-contradiction_runtime,hans-lexical_overlap-contradiction_samples_per_second,hans-lexical_overlap-contradiction_steps_per_second,hans-lexical_overlap-entailment_loss,hans-lexical_overlap-entailment_accuracy,hans-lexical_overlap-entailment_score_accuracy,hans-lexical_overlap-entailment_runtime,hans-lexical_overlap-entailment_samples_per_second,hans-lexical_overlap-entailment_steps_per_second,mnli_loss,mnli_accuracy,mnli_score_accuracy,mnli_runtime,mnli_samples_per_second,mnli_steps_per_second,task_description,pattern,target_tokens,num_shots,separate_shots_by,balanced,shuffle,target_prefix,group,indices,context,data_seed,keep_samples_in-domain,keep_samples_hans-lexical_overlap-entailment,keep_samples_hans-lexical_overlap-contradiction
0,2.30078125,0.0,0.0,190.4604,26.252,2.625,0.2178955078125,1.0,1.0,190.6175,26.231,2.623,1.189453125,0.5198744769874477,0.5198744769874477,256.8748,26.052,2.608,,{text1} \nQuestion: {text2} True or False?,"ĠTrue,ĠFalse",16,\n\n,True,True,\nAnswer: ,eval-harness,"[296325, 280597, 360681, 128688, 94687, 155006, 129224, 367019, 30103, 123600, 178417, 334008, 340179, 191321, 324999, 262722]","The Temple Mount was identified in Islamic tradition as  the farthest spot  (in Arabic, el-aksa), the site to which the Prophet Muhammad was transported in one night from Mecca on a winged horse, as described in the 17th chapter of the Koran. \nQuestion: Mount Sinai is the site where the Prophet Muhammad was transported from Mecca on a winged turtle. True or False?\nAnswer: False\n\nIn Dr. Seuss'  Well, what would you say, if a mother asked you? \nQuestion: What would be your response to a mother be? True or False?\nAnswer: True\n\nBy 8, a few of us have adjourned to the first floor of the courthouse in anticipation of Monica's arrival. \nQuestion: We did not gather on the first floor of the courthouse because of construction. True or False?\nAnswer: False\n\nProperty, plant, and equipment (PP and E) of types that are expensed. \nQuestion: Property, plant, and equipment are never to be expensed. True or False?\nAnswer: False\n\nNo way you'll get that kind of freedom of choice from, say, those bastards at Mobil Exxon! \nQuestion: The freedom of choice will be granted. True or False?\nAnswer: False\n\nSmall Byzantine churches sit on street corners, side by side with family homes. \nQuestion: There is a mix of Byzantine churches and family homes there. True or False?\nAnswer: True\n\nwhich i think is a is an invasion of privacy \nQuestion: This action does not compromise my privacy.  True or False?\nAnswer: False\n\nFinally, its share of total First-Class Mail dropped from 14. \nQuestion: Its share of total First-Class Mail dropped from 14. True or False?\nAnswer: True\n\num there uh Black Sabbath did a few albums that i really like \nQuestion: Black Sabbath has a number of albums that I love. True or False?\nAnswer: True\n\nNow, if we assume that the volume of all sectors and uses in Tables 1, 2, and 3 have an elasticity of one with respect to the number of households (i.e. \nQuestion: Tables 1, 2, and 3 have an elasticity of one True or False?\nAnswer: True\n\nA very few minutes sufficed. \nQuestion: It would take a few hours to finish. True or False?\nAnswer: False\n\nThe subjects of this anthropology looked at Yeats' stylish black London suit--he was always a careful, poetic dresser--and took him to be a proselytizing clergyman. \nQuestion: The anthropology was for Yeats' outfit. True or False?\nAnswer: True\n\nSoaring above it all is a 73-m (239-ft) high minaret, with a graceful balcony from which the muezzin calls the faithful to prayer. \nQuestion: There is a small minaret below it. True or False?\nAnswer: False\n\nof backing up files and protecting passwords \nQuestion: Deleting files and having an easy to guess password. True or False?\nAnswer: False\n\nand you're required to get your car to go through the emission test well my muffler of course starting going bad right before i was supposed to go to the emission test so you know i had to do that job and of course that was back in December when it's nice and cold outside \nQuestion: My muffler starting going out right before I was scheduled to take my car for an emission test. True or False?\nAnswer: True\n\nBut the trouble is that between technology that makes it easier for markets to run rings around local regulations, and the reluctance of governments to agree on the sort of cross-border enforcement that might let them keep up with that technology, efforts to limit the market . Oh, mavericks such as George Lucas or Malaysia's Prime Minister Mahathir bin Muhammad may try to fight the trend and even achieve some limited success, but they are swimming against the tide. \nQuestion: Mahathir bin Muhammad is the Prime Minister of Malaysia. True or False?\nAnswer: True\n\n",6,6692,5000,5000
0,1.6123046875,0.0,0.0,191.4063,26.122,2.612,0.34375,1.0,1.0,191.2589,26.143,2.614,1.0439453125,0.5185295875672444,0.5191273161984459,257.0484,26.034,2.607,,{text1} \nQuestion: {text2} True or False?,"ĠTrue,ĠFalse",16,\n\n,True,True,\nAnswer: ,eval-harness,"[47093, 227891, 264151, 374208, 48921, 239431, 89976, 144213, 92730, 122731, 210775, 19220, 203939, 352101, 222911, 216628]","yes finally we did it didn't take \nQuestion: It didn't take long for us to do. True or False?\nAnswer: True\n\nLast year, the Belgian secretary-general of NATO had to quit over charges that his Flemish Socialist Party accepted $50 million in bribes from a defense contractor. \nQuestion: The Belgian secretary general accepted bribes as he had been photographed with prostitutes in London.  True or False?\nAnswer: False\n\nAs the analysis points out, the House Appropriations Committee report and a floor statement by the principal sponsor of section 330--Representative DeLay--describe section 330 as permitting NHTSA to establish a 1998 standard identical to the model year 1997 standard. \nQuestion:  House Appropriations Committee report and a floor statement by the principal sponsor of section 330 True or False?\nAnswer: True\n\nA permanent independent prosecutor's office would not need to feel that its reputation depended on prosecuting and convicting everyone it investigated. \nQuestion: Permanent independent prosecutors make it a point never to prosecute or convict the cases they are investigating. True or False?\nAnswer: False\n\nTo help you identify these sources, you can use a variety of databases and other research tools, which include the Congressional Research Service Public Policy Literature Abstracts and organizations' Web sites. \nQuestion: There are a variety of research tools that can be used to aid you in identifying these sources. True or False?\nAnswer: True\n\nIt should be noted that the figures of bill/payment and advertising mail presented in Table 2 account only for the First-Class household mail and, thus, represent the lower bound of First-Class bill/payment and advertising mail volumes. \nQuestion: Table 2 only account for higher bounds of First-Class bill mail volumes.  True or False?\nAnswer: False\n\nMartinis, barbecues, cigarettes, adultery--all are now vestigial, but where are the new suburban symbolic hooks? \nQuestion: Barbecues and adultery are not considered vestigial.  True or False?\nAnswer: False\n\nHe waved at my helicopter. \nQuestion: The person walked away from the helicopter. True or False?\nAnswer: False\n\nI laughed.  \nQuestion: I cried. True or False?\nAnswer: False\n\nDoes an egg know it is going to become a hen--or maybe a fish? \nQuestion: Hens and fish are alike in that they both hatch from eggs. True or False?\nAnswer: True\n\nAh, I said, ""now I understand ”"" \nQuestion: I know about it now. True or False?\nAnswer: True\n\nyou know and he goes yeah i just came up here to work and i go oh you did i bet you make uh very good money up here he goes yeah i make a lot a lot of money he goes you know and uh in the movie Good Fellas \nQuestion: We had a conversation about work and money. True or False?\nAnswer: True\n\nyou know tornado season hurricanes and stuff so \nQuestion: Tornado and hurricane season. True or False?\nAnswer: True\n\ni'm exempt \nQuestion: I am not excluded True or False?\nAnswer: False\n\nyeah because there's more and more there's more murders we had uh \nQuestion: There have been fewer murders recently. True or False?\nAnswer: False\n\nAuditors should also report significant constraints imposed on the audit approach by data limitations or scope impairments. \nQuestion: Significant constraints imposed on the audit approach should be reported by auditors. True or False?\nAnswer: True\n\n",7,6692,5000,5000
0,5.765625,0.0,0.078,192.8006,25.934,2.593,5.4140625,0.0,0.938,192.6597,25.952,2.595,4.92578125,0.025552898983861327,0.5418410041841004,259.2763,25.81,2.584,,{text1} {text2} ?,"ĠYes,ĠNo",2,\n\n,True,True, ,minimal,"[284533, 321162]","You'll certainly find a day's visit to Kurashiki a very welcome change from the relentless modernity of some of the cities nearby. Kurashiki presents a nice contrast to the overbearing modernity of other cities. ? Yes\n\nWhere else could you pull down over $90,000 and live such a deadline-free existence? Why can't you live anywhere and make money without having deadlines all the time? ? No\n\n",0,6692,5000,5000
0,5.765625,0.0,0.078,198.3823,25.204,2.52,5.4140625,0.0,0.938,208.2718,24.007,2.401,4.92578125,0.025552898983861327,0.5418410041841004,287.1463,23.305,2.333,,{text1} {text2} ?,"ĠYes,ĠNo",2,\n\n,True,True, ,minimal,"[284533, 321162]","You'll certainly find a day's visit to Kurashiki a very welcome change from the relentless modernity of some of the cities nearby. Kurashiki presents a nice contrast to the overbearing modernity of other cities. ? Yes\n\nWhere else could you pull down over $90,000 and live such a deadline-free existence? Why can't you live anywhere and make money without having deadlines all the time? ? No\n\n",0,6692,5000,5000
0,4.7421875,0.0,0.0,190.3024,26.274,2.627,3.873046875,0.0,1.0,190.3481,26.268,2.627,5.0703125,0.00328750747160789,0.5200239091452481,256.4727,26.092,2.612,,{text1} {text2} ?,"ĠYes,ĠNo",16,\n\n,True,True, ,minimal,"[284533, 224659, 157977, 290451, 263993, 42920, 68588, 308357, 321162, 133503, 342769, 132382, 138402, 230560, 265955, 335658]","In the Indus river valley, improved techniques permitted the storage of wheat and barley beyond daily needs, and so the cities of Harappa and Mohenjodaro emerged in the year 2300 b.c. , creating a civilization even more advanced than that of the Aryans who came later. The Aryans replaced the primitive civilization that preceded them. ? No\n\nMost of the candidates, with the exception of Bush, who hasn't yet taken a stand, also say that certain records, including medical and financial information, should be protected by legislation. Bush hasn't taken a stand on the issue. ? Yes\n\num what is your experience been with like do you have elderly relatives that live with you or have lived with your parents or something like that Are all your relatives dead? ? No\n\nYou'll certainly find a day's visit to Kurashiki a very welcome change from the relentless modernity of some of the cities nearby. Kurashiki presents a nice contrast to the overbearing modernity of other cities. ? Yes\n\nMary looked up at him, the colour slowly rising in her face.  Mary's face gained color as she looked up at him. ? Yes\n\nbut unfortunately people people aren't that insightful All people are extremely insightful.  ? No\n\nhardness, 180-200 mg/L as CaCO3); tests with D. pulex used moderately-hard reconstituted water (total The tests used extra-hard reconstituted water. ? No\n\nThe lawyers provide expert legal service for indigent people who need help with divorces, custody battles, and other family law matters. Indigent people were provided legal service by the lawyers. ? Yes\n\nMaybe we shouldn't attempt to extend the life of every individual. We should extend the life of every body. ? No\n\nSlate is similarly displeased that I invited fellow scholars to write individual introductions for each volume of the Schomburg Library of Nineteenth-Century African-American Women Writers --a series that I conceived and for which I served as general editor. I served as a general editor for a multi-volume series of works.  ? Yes\n\nThey went back and forth, Kal swinging, punching, kicking, biting, and butting with his forehead. Kal was using his fists and feet to attack.  ? Yes\n\nThe company also offers a range of formal classroom training, less formal workshops, and informal mentoring programs. Formal classroom training is not one of the services offered by the company. ? No\n\nWhere else could you pull down over $90,000 and live such a deadline-free existence? Why can't you live anywhere and make money without having deadlines all the time? ? No\n\nBut there it is, she can tell you nothing."" 116 ""But why, man?  But there it is, she has nothin to say. But why man. ? Yes\n\nRegional Differences. Differences between regions. ? Yes\n\nwell i do it all  uh yes i i try to grow uh uh a vegetable garden and I've never tried my hand at a vegetable garden; is it hard? ? No\n\n",0,6692,5000,5000
0,4.7421875,0.0,0.0,191.0054,26.177,2.618,3.873046875,0.0,1.0,190.5579,26.239,2.624,5.0703125,0.00328750747160789,0.5200239091452481,256.4807,26.092,2.612,,{text1} {text2} ?,"ĠYes,ĠNo",16,\n\n,True,True, ,minimal,"[284533, 224659, 157977, 290451, 263993, 42920, 68588, 308357, 321162, 133503, 342769, 132382, 138402, 230560, 265955, 335658]","In the Indus river valley, improved techniques permitted the storage of wheat and barley beyond daily needs, and so the cities of Harappa and Mohenjodaro emerged in the year 2300 b.c. , creating a civilization even more advanced than that of the Aryans who came later. The Aryans replaced the primitive civilization that preceded them. ? No\n\nMost of the candidates, with the exception of Bush, who hasn't yet taken a stand, also say that certain records, including medical and financial information, should be protected by legislation. Bush hasn't taken a stand on the issue. ? Yes\n\num what is your experience been with like do you have elderly relatives that live with you or have lived with your parents or something like that Are all your relatives dead? ? No\n\nYou'll certainly find a day's visit to Kurashiki a very welcome change from the relentless modernity of some of the cities nearby. Kurashiki presents a nice contrast to the overbearing modernity of other cities. ? Yes\n\nMary looked up at him, the colour slowly rising in her face.  Mary's face gained color as she looked up at him. ? Yes\n\nbut unfortunately people people aren't that insightful All people are extremely insightful.  ? No\n\nhardness, 180-200 mg/L as CaCO3); tests with D. pulex used moderately-hard reconstituted water (total The tests used extra-hard reconstituted water. ? No\n\nThe lawyers provide expert legal service for indigent people who need help with divorces, custody battles, and other family law matters. Indigent people were provided legal service by the lawyers. ? Yes\n\nMaybe we shouldn't attempt to extend the life of every individual. We should extend the life of every body. ? No\n\nSlate is similarly displeased that I invited fellow scholars to write individual introductions for each volume of the Schomburg Library of Nineteenth-Century African-American Women Writers --a series that I conceived and for which I served as general editor. I served as a general editor for a multi-volume series of works.  ? Yes\n\nThey went back and forth, Kal swinging, punching, kicking, biting, and butting with his forehead. Kal was using his fists and feet to attack.  ? Yes\n\nThe company also offers a range of formal classroom training, less formal workshops, and informal mentoring programs. Formal classroom training is not one of the services offered by the company. ? No\n\nWhere else could you pull down over $90,000 and live such a deadline-free existence? Why can't you live anywhere and make money without having deadlines all the time? ? No\n\nBut there it is, she can tell you nothing."" 116 ""But why, man?  But there it is, she has nothin to say. But why man. ? Yes\n\nRegional Differences. Differences between regions. ? Yes\n\nwell i do it all  uh yes i i try to grow uh uh a vegetable garden and I've never tried my hand at a vegetable garden; is it hard? ? No\n\n",0,6692,5000,5000
